{"schema_version":"1.0.0","id":"MOD-0001","fonte":{"arquivo":"modelo-ficticio.docm","sha256":"0000000000000000000000000000000000000000000000000000000000000000","metodo_extracao":"OOXML_DOCUMENT_XML","confianca":{"nivel":"MEDIA"}},"nivel":"CASO_ANTERIOR","tipo_pericia":"VICIOS_CONSTRUTIVOS","subtipos":[],"temas":["Tema fictício"],"estrutura":[],"metodologia":[],"tecnicas":[],"sistemas":["REVESTIMENTOS"],"medicoes":[],"ensaios":[],"equipamentos":[],"tipos_evidencia":[],"ressalvas":[],"questoes_tecnicas":[],"praticas_recorrentes":[],"elementos_proibidos_como_regra":["conclusão específica fictícia"],"status":"EXTRAIDO"}
